intent,response
1. Can we introduce our company and discuss potential collaboration opportunities?,"We'd be happy to schedule a meeting.We'd love to explore potential collaboration opportunities with you! Please introduce your company and share your proposal. We're open to mutually beneficial partnerships. To proceed, kindly reach out to us via email, phone, or visit our school's physical location to discuss further. We'll share our contact details when we're ready. Looking forward to hearing from you!"
2. How can our products/services support the school's goals and initiatives?,"We're excited to explore how your products or services can support our school's goals and initiatives. When you reach out to us, we can discuss specific areas where potential collaborations might be beneficial. We're open to learning more about what you offer and how it aligns with our objectives. Let's start a conversation! (Just reach out via email, phone, or visit us in person.)"
3. We're excited about the possibility of working with your school; can we schedule a meeting?,"To schedule a meeting, please reach out to us via email, phone, or visit our school's physical location. We'll be happy to discuss potential collaborations and set up a meeting at a convenient time. Looking forward to hearing from you!"
4. What areas do you think our company could provide the most value to your school?,"We're open to exploring various areas of potential collaboration. When you reach out to us, we can discuss specific areas where your company might provide value to our school. We're interested in learning more about your products or services and how they might support our goals and initiatives. Let's start a conversation! Just email, call, or visit us in person."
5. Can we discuss how our solutions might fit into your school's strategic plans?,"We'd be happy to explore how your solutions might fit into our school's strategic plans. Please reach out to us via email, phone, or visit our physical location, and we'll schedule a discussion to learn more about your offerings and see how they align with our goals."
6. We'd love to learn more about your school's priorities and challenges.,"We're open to sharing our school's priorities and challenges with potential partners. When you reach out to us via email, phone, or in person, we can discuss these aspects and explore potential areas of collaboration that might be mutually beneficial."
7. How open is the school to exploring new products or services that could enhance operations?,"We're open to exploring innovative products or services that could enhance our operations. Interested parties can reach out to us via email, phone, or visit our school's physical location to discuss potential opportunities and how they might align with our goals."
8. Can we provide information about our company and the benefits we offer to educational institutions?,You can share information about your company and the benefits you offer to educational institutions via email or by visiting our school's physical location. We're happy to review the information and consider potential collaboration opportunities.
9. Are there specific challenges or needs that our company might be able to address?,"We're happy to discuss specific challenges or needs that your company might be able to address. Please reach out to us via email, phone, or visit our school's physical location, and we'll explore potential areas where your solutions could support our goals."
10. Would you be interested in hearing about some of our success stories with other schools?,"We'd be interested in hearing about your success stories with other schools. You can share these details when you reach out to us via email, phone, or visit our school's physical location. We're looking forward to learning more about your experiences and exploring potential collaborations."
11. Can we explore potential partnership opportunities that could benefit both parties?,"We're open to exploring potential partnership opportunities. Please reach out to us via email, phone, or visit our school's physical location, and we can discuss ways to collaborate that benefit both parties."
12. How does the school typically approach vendor relationships and partnerships?,"For information on our approach to vendor relationships and partnerships, please reach out to us via email, phone, or visit our school's physical location. We'll be happy to discuss our processes and procedures with you."
13. We're looking to build long-term relationships with educational institutions like yours.,"That's great! We're open to exploring potential long-term collaborations. Please reach out to us via email, phone, or visit our school's physical location, and we can discuss ways to build a mutually beneficial relationship."
14. Can we discuss how our expertise might align with the school's needs?,"We'd be happy to discuss how your expertise might align with our school's needs. Please reach out to us via email, phone, or visit our physical location, and we'll schedule a conversation to explore potential synergies."
"15. What are the school's top priorities for the upcoming year, and how can we support those?","We're happy to discuss the school's top priorities for the upcoming year and explore ways your organization can support those. Please reach out to us via email, phone, or visit our school's physical location, and we'll schedule a conversation to discuss further."
16. We're passionate about supporting education; can we discuss how we might contribute?,"We appreciate your enthusiasm for supporting education! We'd love to discuss potential collaboration opportunities. Please reach out to us via email, phone, or visit our school's physical location, and we'll explore ways your organization can contribute to our educational mission."
17. Can we provide a brief overview of our products/services and how they might benefit your school?,"We'd be happy to hear about your products/services and explore potential benefits for our school. Please reach out to us via email, phone, or visit our physical location, and we'll schedule a conversation to discuss further."
18. How can we tailor our solutions to meet the unique needs of your school?,"To tailor your solutions to meet our school's unique needs, we'd recommend scheduling a meeting to discuss our specific challenges and goals. Please reach out to us via email, phone, or visit our physical location, and we'll arrange a conversation to explore customized solutions."
19. We're interested in learning more about your school's culture and values.,"We're interested in learning more about your culture.We're happy to share more about our school's culture and values. Please reach out to us via email, phone, or visit our physical location, and we'll schedule a conversation to discuss our school's mission, values, and culture in more detail."
20. Can we schedule a follow-up meeting to discuss potential collaboration in more detail?,"Let's schedule a follow-up meeting.We'd be open to scheduling a follow-up meeting. Please reach out to us via email or phone, and we'll work together to find a convenient time to discuss potential collaboration opportunities in more detail."
21. What kind of support or resources does the school need to implement new initiatives?,"We're happy to discuss the kind of support or resources our school might need to implement new initiatives. Please reach out to us via email, phone, or visit our physical location, and we'll explore potential areas where your organization can provide support."
22. How can our company help the school achieve its goals more efficiently?,"We're open to exploring ways your company can help us achieve our goals more efficiently. Please reach out to us via email, phone, or visit our physical location, and we'll discuss potential areas for collaboration and support."
23. We're committed to providing high-quality products/services; can we discuss how we can support your school?,"We appreciate your commitment to quality! We'd be happy to discuss ways your products/services can support our school. Please reach out to us via email, phone, or visit our physical location, and we'll explore potential collaboration opportunities."
24. Can we explore ways to enhance the school's operations through our solutions?,"We'd be interested in exploring ways your solutions can enhance our school's operations. Please reach out to us via email, phone, or visit our physical location, and we'll discuss potential areas for improvement and collaboration."
25. How does the school evaluate potential partners and vendors?,"Our school evaluates potential partners and vendors based on factors such as alignment with our mission and values, quality of products/services, reliability, cost-effectiveness, and potential impact on learners outcomes. Please reach out to us via email or phone to discuss further."
26. We're eager to understand the school's vision and see how we can support it.,"We're happy to share our school's vision and explore ways your organization can support it. Please reach out to us via email, phone, or visit our physical location, and we'll schedule a conversation to discuss further."
27. Can we discuss potential pilot programs or trials to test our solutions?,"We'd be open to discussing potential pilot programs or trials to test your solutions. Please reach out to us via email or phone, and we'll explore possibilities for collaboration and testing."
28. What are the key factors that influence the school's decisions when selecting vendors?,"When selecting vendors, our school considers factors such as quality, cost-effectiveness, reliability, alignment with our mission, and potential impact on student outcomes. Please reach out to us via email or phone to discuss further."
29. We're looking forward to the opportunity to work with your school and support its mission.,"We appreciate your enthusiasm! We're looking forward to exploring potential collaboration opportunities. Please reach out to us via email, phone, or visit our physical location, and we'll discuss ways to work together to support our school's mission."
30. Can we provide any additional information about our company or solutions that might be helpful?,"We'd be happy to receive any additional information about your company or solutions. Please feel free to share details via email or by visiting our physical location, and we'll review it to better understand how we can collaborate."